{
  "$schema":"https://json-schema.org/draft/2020-12/schema","$id":"style-anchor-request.schema.json","title":"P3.2 Style Anchor Request","type":"object","additionalProperties":false,
  "required":["schema_version","artifact_type","deck_id","deck_prompt_package_sha256","deck_visual_system_sha256","slide_id","slide_prompt_sha256","selection_basis","high_risk_slide_ids","status"],
  "properties":{"schema_version":{"const":"1.0"},"artifact_type":{"const":"style_anchor_request"},"deck_id":{"type":"string","minLength":1},"deck_prompt_package_sha256":{"type":"string","pattern":"^[a-f0-9]{64}$"},"deck_visual_system_sha256":{"type":"string","pattern":"^[a-f0-9]{64}$"},"slide_id":{"type":"string","minLength":1},"slide_prompt_sha256":{"type":"string","pattern":"^[a-f0-9]{64}$"},"selection_basis":{"const":"representativeness_first_v1"},"high_risk_slide_ids":{"type":"array","uniqueItems":true,"items":{"type":"string","minLength":1}},"status":{"const":"ready_for_generation"}}
}
